{
  "schemaVersion": 2,
  "program": "Runefall v0.2 Remediation Program",
  "plan": "Runefall/SPECS/ULTIMATE-PLAN.md",
  "planVersion": "v2",
  "sourceRevision": "a50b2b6",
  "baseline": {
    "verifiedAt": "2026-10-28",
    "reports": [
      {
        "path": "build/audit/plan-gaps.md",
        "sha256": "4117EC7C861635412F1B260CFD0E5B0208C1C2D4C70AEF4DA8828CF3FC0B3C17"
      },
      {
        "path": "build/audit/runtime-gaps.md",
        "sha256": "4AEE2879FE7090096306D4548721B233DF4AAB655E0AE5BD9FD85711CAA8AE6A"
      }
    ],
    "counts": {
      "PASS": 7,
      "PARTIAL": 30,
      "FAIL": 11
    },
    "normalisation": "UNVERIFIED and PARTIAL/UNVERIFIED -> PARTIAL"
  },
  "overallStatus": "IN_PROGRESS",
  "currentSlice": "S0",
  "updatedAt": "2026-10-28T09:17:55.496Z",
  "remediation": {
    "S0": {
      "id": "S0",
      "state": "IMPLEMENTING",
      "status": "NOT_STARTED",
      "contract": {
        "path": "build/slices/S0/spec.md",
        "sha256": "D543CCEC5EB18013245DF9F0F55C3A3CDF1DA4ECBBCA164E318CA7EB1D7359A0"
      },
      "specAudit": {
        "path": "build/audit/S0-spec-audit-5.md",
        "sha256": "A1DA0F2E6305F009F1C51131A20DC995DF0233E765FC0224EAFD9D6F9E72DDED",
        "verdict": "APPROVED",
        "recordCommit": null
      },
      "implementationAudit": null,
      "commit": null,
      "evidence": [
        {
          "path": "build/slices/S0/spec.md",
          "sha256": "D543CCEC5EB18013245DF9F0F55C3A3CDF1DA4ECBBCA164E318CA7EB1D7359A0",
          "kind": "report",
          "exists": true
        },
        {
          "path": "build/audit/S0-spec-audit-5.md",
          "sha256": "A1DA0F2E6305F009F1C51131A20DC995DF0233E765FC0224EAFD9D6F9E72DDED",
          "kind": "report",
          "exists": true
        }
      ],
      "blockers": [],
      "followups": []
    },
    "S1": {
      "id": "S1",
      "state": "PENDING",
      "status": "NOT_STARTED",
      "contract": null,
      "specAudit": null,
      "implementationAudit": null,
      "commit": null,
      "evidence": [],
      "blockers": [],
      "followups": []
    },
    "S2": {
      "id": "S2",
      "state": "PENDING",
      "status": "NOT_STARTED",
      "contract": null,
      "specAudit": null,
      "implementationAudit": null,
      "commit": null,
      "evidence": [],
      "blockers": [],
      "followups": []
    },
    "S3": {
      "id": "S3",
      "state": "PENDING",
      "status": "NOT_STARTED",
      "contract": null,
      "specAudit": null,
      "implementationAudit": null,
      "commit": null,
      "evidence": [],
      "blockers": [],
      "followups": []
    },
    "S4": {
      "id": "S4",
      "state": "PENDING",
      "status": "NOT_STARTED",
      "contract": null,
      "specAudit": null,
      "implementationAudit": null,
      "commit": null,
      "evidence": [],
      "blockers": [],
      "followups": []
    },
    "S5": {
      "id": "S5",
      "state": "PENDING",
      "status": "NOT_STARTED",
      "contract": null,
      "specAudit": null,
      "implementationAudit": null,
      "commit": null,
      "evidence": [],
      "blockers": [],
      "followups": []
    },
    "S6": {
      "id": "S6",
      "state": "PENDING",
      "status": "NOT_STARTED",
      "contract": null,
      "specAudit": null,
      "implementationAudit": null,
      "commit": null,
      "evidence": [],
      "blockers": [],
      "followups": []
    },
    "S7": {
      "id": "S7",
      "state": "PENDING",
      "status": "NOT_STARTED",
      "contract": null,
      "specAudit": null,
      "implementationAudit": null,
      "commit": null,
      "evidence": [],
      "blockers": [],
      "followups": []
    },
    "S8": {
      "id": "S8",
      "state": "PENDING",
      "status": "NOT_STARTED",
      "contract": null,
      "specAudit": null,
      "implementationAudit": null,
      "commit": null,
      "evidence": [],
      "blockers": [],
      "followups": []
    },
    "S9": {
      "id": "S9",
      "state": "PENDING",
      "status": "NOT_STARTED",
      "contract": null,
      "specAudit": null,
      "implementationAudit": null,
      "commit": null,
      "evidence": [],
      "blockers": [],
      "followups": [
        {
          "id": "UI-DEP-1",
          "detail": "FOMOD info.xml requires SKSE Menu Framework while ULTIMATE-PLAN names Prisma UI as hard dependency; resolve/declare in S9"
        }
      ]
    },
    "S10": {
      "id": "S10",
      "state": "PENDING",
      "status": "NOT_STARTED",
      "contract": null,
      "specAudit": null,
      "implementationAudit": null,
      "commit": null,
      "evidence": [],
      "blockers": [],
      "followups": []
    },
    "S11": {
      "id": "S11",
      "state": "PENDING",
      "status": "NOT_STARTED",
      "contract": null,
      "specAudit": null,
      "implementationAudit": null,
      "commit": null,
      "evidence": [],
      "blockers": [],
      "followups": []
    },
    "S12": {
      "id": "S12",
      "state": "PENDING",
      "status": "NOT_STARTED",
      "contract": null,
      "specAudit": null,
      "implementationAudit": null,
      "commit": null,
      "evidence": [],
      "blockers": [],
      "followups": []
    },
    "S13": {
      "id": "S13",
      "state": "PENDING",
      "status": "NOT_STARTED",
      "contract": null,
      "specAudit": null,
      "implementationAudit": null,
      "commit": null,
      "evidence": [],
      "blockers": [],
      "followups": []
    },
    "S14": {
      "id": "S14",
      "state": "PENDING",
      "status": "NOT_STARTED",
      "contract": null,
      "specAudit": null,
      "implementationAudit": null,
      "commit": null,
      "evidence": [],
      "blockers": [],
      "followups": []
    },
    "S15": {
      "id": "S15",
      "state": "PENDING",
      "status": "NOT_STARTED",
      "contract": null,
      "specAudit": null,
      "implementationAudit": null,
      "commit": null,
      "evidence": [],
      "blockers": [],
      "followups": []
    }
  },
  "slices": {
    "F0.1": {
      "id": "F0.1",
      "layer": "L0",
      "slice": "Ladder audit fixes (first slice)",
      "status": "PASS",
      "baselineAudit": {
        "reports": [
          {
            "report": "build/audit/plan-gaps.md",
            "verdict": "PASS",
            "sha256": "4117EC7C861635412F1B260CFD0E5B0208C1C2D4C70AEF4DA8828CF3FC0B3C17"
          }
        ],
        "commit": "a50b2b6"
      },
      "commit": "a50b2b6",
      "evidence": [
        {
          "path": "build/evidence/batch-test-20261028-050132.md",
          "sha256": null,
          "kind": "log",
          "exists": false
        },
        {
          "path": "build/evidence/static-gates-20261028-050307.md",
          "sha256": null,
          "kind": "log",
          "exists": false
        },
        {
          "path": "build/evidence/f0.1-evidence-20261028.md",
          "sha256": null,
          "kind": "log",
          "exists": false
        },
        {
          "path": "build/evidence/batch-test-20261028-050606.md",
          "sha256": null,
          "kind": "log",
          "exists": false
        }
      ],
      "blockers": [],
      "followups": [],
      "checklist": {
        "request-abi": {
          "criterionStatus": "PASS",
          "detail": "PASS"
        },
        "default-difficulty": {
          "criterionStatus": "PASS",
          "detail": "PASS"
        },
        "curve-legacy-load": {
          "criterionStatus": "PASS",
          "detail": "PASS"
        },
        "table-validation": {
          "criterionStatus": "PASS",
          "detail": "PASS"
        },
        "co-save-v3": {
          "criterionStatus": "PASS",
          "detail": "PASS"
        },
        "tier-keyword-retirement": {
          "criterionStatus": "PASS",
          "detail": "PASS"
        },
        "generator-validator": {
          "criterionStatus": "PASS",
          "detail": "PASS"
        },
        "batch-no-crash": {
          "criterionStatus": "PASS",
          "detail": "PASS"
        },
        "static-gates": {
          "criterionStatus": "PASS",
          "detail": "PASS"
        },
        "wire-into-loot-rank": {
          "criterionStatus": "PASS",
          "detail": "PASS_BRIDGE"
        },
        "host-core-tests-benchmark": {
          "criterionStatus": "PASS",
          "detail": "PASS"
        }
      },
      "acceptance": "audit blockers closed, 20+ self-tests, batch PASS, no dual system, no crash",
      "depends": "current"
    },
    "F0.2": {
      "id": "F0.2",
      "layer": "L0",
      "slice": "Freeze JSON schema",
      "status": "PARTIAL",
      "baselineAudit": {
        "reports": [
          {
            "report": "build/audit/plan-gaps.md",
            "verdict": "PARTIAL",
            "sha256": "4117EC7C861635412F1B260CFD0E5B0208C1C2D4C70AEF4DA8828CF3FC0B3C17"
          }
        ],
        "commit": "a50b2b6"
      },
      "commit": "a50b2b6",
      "evidence": [
        {
          "path": "build/evidence/static-gates-20261028-051731.md",
          "sha256": null,
          "kind": "log",
          "exists": false
        },
        {
          "path": "content/schema/validate_content.py",
          "sha256": null,
          "kind": "report",
          "exists": false
        }
      ],
      "blockers": [],
      "followups": [],
      "checklist": {
        "schemas": {
          "criterionStatus": "PASS",
          "detail": "PASS_28"
        },
        "base-pack": {
          "criterionStatus": "PASS",
          "detail": "PASS_7_entities"
        },
        "validation": {
          "criterionStatus": "PASS",
          "detail": "PASS"
        },
        "static-gate": {
          "criterionStatus": "PASS",
          "detail": "PASS"
        }
      },
      "acceptance": "all current content represented; schema validation passes; no CSV authoring",
      "depends": "F0.1"
    },
    "F0.3": {
      "id": "F0.3",